{
  "arn": "arn:aws:service:us-east-1:123456789012:resource/example",
  "status": "ACTIVE",
  "createdAt": "example-value",
  "failureCode": "example-value",
  "failureReason": "example-value",
  "clientRequestToken": "example-value",
  "worlds": "example-value",
  "outputLocation": "example-value",
  "iamRole": "example-value",
  "tags": "example-value"
}